ItemName,Time,Comment,Score,Assess贝因美(Beingmate) 冠军宝贝 幼儿配方奶粉 3段(1-3岁幼儿适用) 1000克,2018-01-26,奶粉很好f专卖店一样,5,好评
贝因美(Beingmate) 冠军宝贝 幼儿配方奶粉 3段(1-3岁幼儿适用) 1000克,2018-01-26,已经买了很多次了，就是希望价格可以一直这样便宜就好了。,5,好评
贝因美(Beingmate) 冠军宝贝 幼儿配方奶粉 3段(1-3岁幼儿适用) 1000克,2018-01-26,宝宝一直喝的这个，感谢京东,5,好评
贝因美(Beingmate) 冠军宝贝 幼儿配方奶粉 3段(1-3岁幼儿适用) 1000克,2018-01-26,宝宝一直喝这个牌子的奶粉，快递很给力，隔天就到了！,5,好评
贝因美(Beingmate) 冠军宝贝 幼儿配方奶粉 3段(1-3岁幼儿适用) 1000克,2018-01-26,京东发货非常快，没得说，快递也非常给力，到的非常及时，很满意。,5,好评
贝因美(Beingmate) 冠军宝贝 幼儿配方奶粉 3段(1-3岁幼儿适用) 1000克,2018-01-26,这次等几天都没货，不过这次买的挺优惠的,5,好评
贝因美(Beingmate) 冠军宝贝 幼儿配方奶粉 3段(1-3岁幼儿适用) 1000克,2018-01-26,一直给宝宝买的这个，好像是降价了,5,好评
贝因美(Beingmate) 冠军宝贝 幼儿配方奶粉 3段(1-3岁幼儿适用) 1000克,2018-01-26,快递速度挺快的，包装也不错,5,好评
贝因美(Beingmate) 冠军宝贝 幼儿配方奶粉 3段(1-3岁幼儿适用) 1000克,2018-01-26,经常在京东购物，东西好而且还很实惠，不用去超市大包小包的扛，省事多了。,5,好评
贝因美(Beingmate) 冠军宝贝 幼儿配方奶粉 3段(1-3岁幼儿适用) 1000克,2018-01-26,很好，从小一直喝的就是这个牌子，很放心，二宝也会准备,5,好评
贝因美(Beingmate) 冠军宝贝 幼儿配方奶粉 3段(1-3岁幼儿适用) 1000克,2018-01-26,京东自营服务好一直购买这个品牌,5,好评
贝因美(Beingmate) 冠军宝贝 幼儿配方奶粉 3段(1-3岁幼儿适用) 1000克,2018-01-26,正品。比实体店便宜，发货很快，服务很好，满意,5,好评
贝因美(Beingmate) 冠军宝贝 幼儿配方奶粉 3段(1-3岁幼儿适用) 1000克,2018-01-26,儿子一直用的牌子，挺满意的。快递哥也很给力。,5,好评
贝因美(Beingmate) 冠军宝贝 幼儿配方奶粉 3段(1-3岁幼儿适用) 1000克,2018-01-26,发货速度挺快，态度相当好,5,好评
贝因美(Beingmate) 冠军宝贝 幼儿配方奶粉 3段(1-3岁幼儿适用) 1000克,2018-01-26,一如既往这个牌子，家里孩子都吃这个牌子奶粉，下次买个箐爱的试试。。。。。。,5,好评
贝因美(Beingmate) 冠军宝贝 幼儿配方奶粉 3段(1-3岁幼儿适用) 1000克,2018-01-26,不错的一次购物，京东最棒，最好用！,5,好评
贝因美(Beingmate) 冠军宝贝 幼儿配方奶粉 3段(1-3岁幼儿适用) 1000克,2018-01-26,我家儿子就爱喝这种，我会一直关注的，很不错。,5,好评
贝因美(Beingmate) 冠军宝贝 幼儿配方奶粉 3段(1-3岁幼儿适用) 1000克,2018-01-26,发货速度很快，支持下，客服服务很好！,5,好评
贝因美(Beingmate) 冠军宝贝 幼儿配方奶粉 3段(1-3岁幼儿适用) 1000克,2018-01-26,宝宝一直再喝这个奶粉，挺好的，满意,5,好评
