ItemName,Time,Comment,Score,Assess贝因美(Beingmate) 金装爱+ 幼儿配方奶粉 3段(12-36个月幼儿适用) 1000克,2016-01-27,我花钱买的奶粉安全保险为什么没有,1,差评
贝因美(Beingmate) 金装爱+ 幼儿配方奶粉 3段(12-36个月幼儿适用) 1000克,2016-01-22,有点甜，总有化不来的颗粒，喝到嘴里像沙子一样,1,差评
贝因美(Beingmate) 金装爱+ 幼儿配方奶粉 3段(12-36个月幼儿适用) 1000克,2016-01-19,一般般吧！。。。。。。。。。。,1,差评
贝因美(Beingmate) 金装爱+ 幼儿配方奶粉 3段(12-36个月幼儿适用) 1000克,2016-01-17,这奶粉是假的吧，问题太大了，我小孩第一天吃就皮肤过敏，以为是体质问题就不给我小孩吃了，然后给我侄子吃，我侄子吃了之后就拉肚子，两个侄子吃了都拉肚子，这难道也是体质问题吗？,1,差评
贝因美(Beingmate) 金装爱+ 幼儿配方奶粉 3段(12-36个月幼儿适用) 1000克,2016-01-17,奶粉可以，就是京东快递太差，不送货，要自己去拿，晚上下大雨还要去拿货，不然就要拿回去，不是付了款我都不要了,1,差评
贝因美(Beingmate) 金装爱+ 幼儿配方奶粉 3段(12-36个月幼儿适用) 1000克,2016-01-17,收到没有勺子，怎么量？,1,差评
贝因美(Beingmate) 金装爱+ 幼儿配方奶粉 3段(12-36个月幼儿适用) 1000克,2016-01-15,我是京东金牌用户，可是京东快递的快递人员竟然把快件只送到村口，以前的快递员不是这样的，上次就把快件送到村口，把我老婆累的感冒了，（她在家看孩子，跑着去的）这次还跟我玩这个，不差评都不行了！,1,差评
贝因美(Beingmate) 金装爱+ 幼儿配方奶粉 3段(12-36个月幼儿适用) 1000克,2016-01-15,不晓得是不是正品 反正我娃娃吃了拉肚子 浪费我的钱啊,1,差评
贝因美(Beingmate) 金装爱+ 幼儿配方奶粉 3段(12-36个月幼儿适用) 1000克,2016-01-15,积分刮开就说呗领取了，很难 开了啊,1,差评
贝因美(Beingmate) 金装爱+ 幼儿配方奶粉 3段(12-36个月幼儿适用) 1000克,2016-01-14,勺子？？每次买都不配勺子的？？,1,差评
贝因美(Beingmate) 金装爱+ 幼儿配方奶粉 3段(12-36个月幼儿适用) 1000克,2016-01-13,说实话，这批10月份的奶粉不如2015年1月份生产的那一批，粉质粗糙，颜色黯淡，很差的样子,1,差评
贝因美(Beingmate) 金装爱+ 幼儿配方奶粉 3段(12-36个月幼儿适用) 1000克,2016-01-11,不会是假的吧，这罐奶粉小孩不喝！,1,差评
贝因美(Beingmate) 金装爱+ 幼儿配方奶粉 3段(12-36个月幼儿适用) 1000克,2016-01-10,，，，，，，，，，，,1,差评
贝因美(Beingmate) 金装爱+ 幼儿配方奶粉 3段(12-36个月幼儿适用) 1000克,2016-01-07,我感觉东西不纯，有作假的可能，原来专卖店买的都不挂勺子，现在每次瓦几勺，勺子上都黏住一大块，失望，奶味也不浓,1,差评
贝因美(Beingmate) 金装爱+ 幼儿配方奶粉 3段(12-36个月幼儿适用) 1000克,2016-01-06,包装破损，不知道有没有被调包！京东什么这样过。,1,差评
贝因美(Beingmate) 金装爱+ 幼儿配方奶粉 3段(12-36个月幼儿适用) 1000克,2016-01-04,快递太慢，东西没到就显示收获了，卖东西的客服都不管，叫帮忙查下都不干，我是第一次在京东上买东西，也是最后一次 。,1,差评
贝因美(Beingmate) 金装爱+ 幼儿配方奶粉 3段(12-36个月幼儿适用) 1000克,2016-01-04,孩子一直吃这个牌子，买第二罐了，可是吃这一罐又吐又拉，不知道是什么原因，心情很不好,1,差评
贝因美(Beingmate) 金装爱+ 幼儿配方奶粉 3段(12-36个月幼儿适用) 1000克,2016-01-02,一直喝这个奶粉，这次两桶奶粉不知道怎么回事，打开奶粉感觉里面奶粉很潮湿，和以往的不太一样。喝上就拉肚子，还打了三天针,1,差评
贝因美(Beingmate) 金装爱+ 幼儿配方奶粉 3段(12-36个月幼儿适用) 1000克,2016-01-01,这价格变动也太任性了吧才几天降了一半下来！我买的*！不带东子这么坑,1,差评
贝因美(Beingmate) 金装爱+ 幼儿配方奶粉 3段(12-36个月幼儿适用) 1000克,2015-12-29,什么破奶粉啊，今天第一次喝完了宝宝就拉肚子，换奶粉嘛以为正常的，结果呢，大人喝了也拉肚子，在京东买了那么多东西第一次给宝宝换奶粉就买到假的，垃圾京东，奶粉是小孩子喝的这东西能假么？害人啊，大人的肠胃都受不了你说说你买的是啥？？？,1,差评
贝因美(Beingmate) 金装爱+ 幼儿配方奶粉 3段(12-36个月幼儿适用) 1000克,2015-12-27,宝贝吃的拉肚子，孩子吃的一直是贝因美，以前都是在超市买的，这次在京东买的同样的奶粉，宝贝吃了之后就开始拉肚子。问客服，建议说和以前吃的奶粉一块吃吃，让宝贝过度适应一下。我呵呵了，又不是换品牌了，换不同系列了需要适应什么。,1,差评
贝因美(Beingmate) 金装爱+ 幼儿配方奶粉 3段(12-36个月幼儿适用) 1000克,2015-12-26,积分又被兑换过了！怎么一会有一会没的！你要是不能兑换积分！你事先说明！搞的都不敢买了！,1,差评
贝因美(Beingmate) 金装爱+ 幼儿配方奶粉 3段(12-36个月幼儿适用) 1000克,2015-12-26,准备转奶，买一罐来先试试宝宝适应不适应，居然没有量勺，你们是搞笑的吗？绝比差评！！！！！！！！！！！！！！！,1,差评
贝因美(Beingmate) 金装爱+ 幼儿配方奶粉 3段(12-36个月幼儿适用) 1000克,2015-12-25,不知道怎么样呢？第一次给宝宝吃这个牌子！,1,差评
贝因美(Beingmate) 金装爱+ 幼儿配方奶粉 3段(12-36个月幼儿适用) 1000克,2015-12-23,上官网充积分，显示两罐积分都被充过了，无语，不知道是不是正品,1,差评
贝因美(Beingmate) 金装爱+ 幼儿配方奶粉 3段(12-36个月幼儿适用) 1000克,2015-12-23,上官网充积分，显示两罐积分都被充过了，无语，不知道是不是正品,1,差评
贝因美(Beingmate) 金装爱+ 幼儿配方奶粉 3段(12-36个月幼儿适用) 1000克,2015-12-21,不知道是真是假的，我家宝宝不喝，然后从超市买的，宝宝就喝了。请大家小心被骗,1,差评
贝因美(Beingmate) 金装爱+ 幼儿配方奶粉 3段(12-36个月幼儿适用) 1000克,2015-12-18,1234567890,1,差评
贝因美(Beingmate) 金装爱+ 幼儿配方奶粉 3段(12-36个月幼儿适用) 1000克,2015-12-18,"没有以前在超市买的好了
",1,差评
贝因美(Beingmate) 金装爱+ 幼儿配方奶粉 3段(12-36个月幼儿适用) 1000克,2015-12-17,京东，难道缺勺子吗？一个勺子也不给！！！！！！！！！！！！！！！！！,1,差评
贝因美(Beingmate) 金装爱+ 幼儿配方奶粉 3段(12-36个月幼儿适用) 1000克,2015-12-16,奶粉有结块，不知为什么,1,差评
贝因美(Beingmate) 金装爱+ 幼儿配方奶粉 3段(12-36个月幼儿适用) 1000克,2015-12-16,差评是给客服的，态度差差差,1,差评
贝因美(Beingmate) 金装爱+ 幼儿配方奶粉 3段(12-36个月幼儿适用) 1000克,2015-12-16,感觉不是正品，和在专卖店买的颜色不一样，价格太便宜了。,1,差评
贝因美(Beingmate) 金装爱+ 幼儿配方奶粉 3段(12-36个月幼儿适用) 1000克,2015-12-15,东西都没有收到居然还显示完成了交易？京东也玩虚假交易？人为？系统故障？你让我们用户再怎么相信你？,1,差评
贝因美(Beingmate) 金装爱+ 幼儿配方奶粉 3段(12-36个月幼儿适用) 1000克,2015-12-14,没给发量勺，联系客服还没人理,1,差评
贝因美(Beingmate) 金装爱+ 幼儿配方奶粉 3段(12-36个月幼儿适用) 1000克,2015-12-14,老婆说里面有头发状异物，以后不再买这个了。,1,差评
贝因美(Beingmate) 金装爱+ 幼儿配方奶粉 3段(12-36个月幼儿适用) 1000克,2015-12-13,说什么双十二有优惠，这不骗人吗，我昨天刚买的今天十三号了居然比十二号便宜了好几块钱，这不骗人吗？我一直买这个牌子，真是让人生气！！,1,差评
贝因美(Beingmate) 金装爱+ 幼儿配方奶粉 3段(12-36个月幼儿适用) 1000克,2015-12-11,京东的东西现在真贵，以前从不比较，京东价格便宜还保证质量，今天打开*一看，我擦一样的东西比人家*自营的*上下，以后再也不来了，擦！,1,差评
贝因美(Beingmate) 金装爱+ 幼儿配方奶粉 3段(12-36个月幼儿适用) 1000克,2015-12-10,奶粉还没喝，还不知道，外包装和实体店买的颜色不大一样。还有就是写着要发票，结果连个发货单都没有。无语了。,1,差评
贝因美(Beingmate) 金装爱+ 幼儿配方奶粉 3段(12-36个月幼儿适用) 1000克,2015-12-08,上周五晚上9点下单的，这星期一晚上送到的，送到时我都已经关了店门回家了，东西被放在隔壁家，也不给我打个电话通知下，还有一个就是包装盒子打开，只看到了奶瓶连个勺子都没，本来女儿的奶粉就已经吃到见底了才买的，少吃了两顿不说连个勺子真是无语了,1,差评
贝因美(Beingmate) 金装爱+ 幼儿配方奶粉 3段(12-36个月幼儿适用) 1000克,2015-12-08,不知道为什么，这次的孩子一口都不喝。,1,差评
贝因美(Beingmate) 金装爱+ 幼儿配方奶粉 3段(12-36个月幼儿适用) 1000克,2015-12-07,罐子里有黑色的东西反应也没人理，本来对京东的服很满意的现在看来也太差了，这也太不负责任了吧！我们家宝宝万一喝出什么问题谁负责，奉劝各位都不要在这买！！！,1,差评
贝因美(Beingmate) 金装爱+ 幼儿配方奶粉 3段(12-36个月幼儿适用) 1000克,2015-12-06,奶粉连个勺子都没有，请问怎么吃？,1,差评
贝因美(Beingmate) 金装爱+ 幼儿配方奶粉 3段(12-36个月幼儿适用) 1000克,2015-12-05,没有勺子，奶粉盖子很松，垃圾。,1,差评
贝因美(Beingmate) 金装爱+ 幼儿配方奶粉 3段(12-36个月幼儿适用) 1000克,2015-12-05,第一次网够奶粉速度满快的，不知质量是怎样丶丶丶,1,差评
贝因美(Beingmate) 金装爱+ 幼儿配方奶粉 3段(12-36个月幼儿适用) 1000克,2015-12-03,国产奶粉真不行!垃圾，颜色和国外的都不一样，泛白,1,差评
贝因美(Beingmate) 金装爱+ 幼儿配方奶粉 3段(12-36个月幼儿适用) 1000克,2015-12-02,差差差评差差评差差评,1,差评
贝因美(Beingmate) 金装爱+ 幼儿配方奶粉 3段(12-36个月幼儿适用) 1000克,2015-12-02,快递挺快的，不过好像跟我在实体店买的不一样，不是很细腻。,1,差评
贝因美(Beingmate) 金装爱+ 幼儿配方奶粉 3段(12-36个月幼儿适用) 1000克,2015-12-02,垃圾京东，坑人京东，价格垃圾,1,差评
贝因美(Beingmate) 金装爱+ 幼儿配方奶粉 3段(12-36个月幼儿适用) 1000克,2015-12-01,怎么没有勺子呢？奶粉罐上都写了：&ldquo;请向店方索取贝因美奶粉专用白色量勺！！&rdquo;难不成用手抓奶粉吗！！！,1,差评
贝因美(Beingmate) 金装爱+ 幼儿配方奶粉 3段(12-36个月幼儿适用) 1000克,2015-11-30,不好，在京东买了不少贝因美了。这次最不满意，感觉像假的奶粉。冲奶粉的时候感觉不像以前化的快。还有颗粒化不开，以后不敢买了,1,差评
贝因美(Beingmate) 金装爱+ 幼儿配方奶粉 3段(12-36个月幼儿适用) 1000克,2015-11-30,怎么没有勺子？难道要用手抓吗？这一点希望京东改进！,1,差评
贝因美(Beingmate) 金装爱+ 幼儿配方奶粉 3段(12-36个月幼儿适用) 1000克,2015-11-30,二维码被涂开，不知道什么原因，客服没有给出具体原因，算了，他们也解释不出啥来，不敢给宝宝喝了。,1,差评
贝因美(Beingmate) 金装爱+ 幼儿配方奶粉 3段(12-36个月幼儿适用) 1000克,2015-11-28,我只能说京东你太扯淡了，买了几罐一个勺子都没有，联系客服本以为会补发几个，客服牛逼哄哄的说这个没有勺子，你们家的孩子都是吃的手抓奶粉长大的吗？差?差！奶粉时间长，差？,1,差评
贝因美(Beingmate) 金装爱+ 幼儿配方奶粉 3段(12-36个月幼儿适用) 1000克,2015-11-28,已经第N次不给勺子了。投诉了就好了点。不投诉就不给，难道让我用手抓,1,差评
贝因美(Beingmate) 金装爱+ 幼儿配方奶粉 3段(12-36个月幼儿适用) 1000克,2015-11-28,第一次在京东买奶粉，宝宝对贝因美奶粉过敏，喝不成，浪费了。,1,差评
贝因美(Beingmate) 金装爱+ 幼儿配方奶粉 3段(12-36个月幼儿适用) 1000克,2015-11-28,有时有勺子有时没有，发货的人有问题，应该扣他们工资。,1,差评
贝因美(Beingmate) 金装爱+ 幼儿配方奶粉 3段(12-36个月幼儿适用) 1000克,2015-11-27,给一分的原因就是：我竟然在泡奶的时候发现奶粉里面有类似蜘蛛网的东西，还蛮长的，这叫我如何给高分。不是京东自营，我都怀疑是不是正品,1,差评
贝因美(Beingmate) 金装爱+ 幼儿配方奶粉 3段(12-36个月幼儿适用) 1000克,2015-11-26,宝宝以前一直吃这个牌子，但是在这里买了一桶吃了两天，宝宝嘴巴有点红肿，这是怎么回事，再不来了，还是不如在超市买的放心,1,差评
贝因美(Beingmate) 金装爱+ 幼儿配方奶粉 3段(12-36个月幼儿适用) 1000克,2015-11-26,太过随便，包装，快递都是很烂，很随便,1,差评
贝因美(Beingmate) 金装爱+ 幼儿配方奶粉 3段(12-36个月幼儿适用) 1000克,2015-11-25,送货送了15天。真是垃圾商家,1,差评
贝因美(Beingmate) 金装爱+ 幼儿配方奶粉 3段(12-36个月幼儿适用) 1000克,2015-11-24,不知道是真是假，盖子打开再按就按不紧了！奶粉不细腻,1,差评
贝因美(Beingmate) 金装爱+ 幼儿配方奶粉 3段(12-36个月幼儿适用) 1000克,2015-11-23,这次太差劲了，没有小勺让我用手挖着吃吗？包装也没有空气挤压包装！联系了几天客服，客服天天不在！这是买奶粉第一次差评！差评！差评！差    ，，评 ！！,1,差评
贝因美(Beingmate) 金装爱+ 幼儿配方奶粉 3段(12-36个月幼儿适用) 1000克,2015-11-23,买个东西都不给勺，给你们联系都没人搭理，服务太垃圾,1,差评
贝因美(Beingmate) 金装爱+ 幼儿配方奶粉 3段(12-36个月幼儿适用) 1000克,2015-11-23,每次都不给勺子 你让老子用手抓啊 说过几次了 还不给 这次买了900克 和1000克的两种还是没给勺子 你们京东任性 咱不陪你们任性  以后不买你们京东东西可以了吧,1,差评
贝因美(Beingmate) 金装爱+ 幼儿配方奶粉 3段(12-36个月幼儿适用) 1000克,2015-11-23,每次都不给勺子 说补发完了  我也没收到过 说封在奶粉里一桶吃完都不见勺子 没勺子你让老子用手抓啊 连续两次送货时间内没有到达 客服永远都是机器人也不给回 我在你们京东一年花的钱不多也就几千到一万 但是就平你们的这样的态度从此再也不在你们京东花一分钱 店大欺客 咱换一家 不受这气,1,差评
贝因美(Beingmate) 金装爱+ 幼儿配方奶粉 3段(12-36个月幼儿适用) 1000克,2015-11-22,罐子压变形了，给人影响很不好,1,差评
贝因美(Beingmate) 金装爱+ 幼儿配方奶粉 3段(12-36个月幼儿适用) 1000克,2015-11-22,一般般。小孩吃的有点上火,1,差评
贝因美(Beingmate) 金装爱+ 幼儿配方奶粉 3段(12-36个月幼儿适用) 1000克,2015-11-21,不知道是不是真奶粉。我婆婆今天跟我说小孩吃了肚子疼，我的天呀，怎么不早点跟我说，现在才说吃这个奶粉会肚子疼。我马上评价了，本来还想买的，现在不敢了买了。,1,差评
贝因美(Beingmate) 金装爱+ 幼儿配方奶粉 3段(12-36个月幼儿适用) 1000克,2015-11-21,说17号帮我送到，到了20号才到，你发的是乌龟达快递吗，,1,差评
贝因美(Beingmate) 金装爱+ 幼儿配方奶粉 3段(12-36个月幼儿适用) 1000克,2015-11-20,假货，吃了拉肚子，果断扔,1,差评
贝因美(Beingmate) 金装爱+ 幼儿配方奶粉 3段(12-36个月幼儿适用) 1000克,2015-11-19,跟以前有点不一样，是不是双十一的问题(O_O)？,1,差评
贝因美(Beingmate) 金装爱+ 幼儿配方奶粉 3段(12-36个月幼儿适用) 1000克,2015-11-19,为什么没妁子，，，，，，，，，，，,1,差评
贝因美(Beingmate) 金装爱+ 幼儿配方奶粉 3段(12-36个月幼儿适用) 1000克,2015-11-18,以次充好 含包装 还换peifang贝因美好缺德,1,差评
贝因美(Beingmate) 金装爱+ 幼儿配方奶粉 3段(12-36个月幼儿适用) 1000克,2015-11-18,包装太简单，罐子压变形了！最可气的连勺子都没有。客服态度差。,1,差评
贝因美(Beingmate) 金装爱+ 幼儿配方奶粉 3段(12-36个月幼儿适用) 1000克,2015-11-18,这次买的有问题，孩子不爱吃了，又从母婴用品店买了些孩子就爱吃,1,差评
贝因美(Beingmate) 金装爱+ 幼儿配方奶粉 3段(12-36个月幼儿适用) 1000克,2015-11-17,宝宝还不到两岁 喝着喝着把自己奶粉给戒了 还有两桶 可以退货吗 呵呵,1,差评
贝因美(Beingmate) 金装爱+ 幼儿配方奶粉 3段(12-36个月幼儿适用) 1000克,2015-11-17,差差差，一星给快递的.........你们都是用手抓的吧，勺子不给发，答应补发又不发，答应补京豆，又不给，没信誉,1,差评
贝因美(Beingmate) 金装爱+ 幼儿配方奶粉 3段(12-36个月幼儿适用) 1000克,2015-11-16,铁罐有明显被压进去的痕迹，奶粉都有点出来了一样，估计是货多压的，唉，懒得退了。,1,差评
贝因美(Beingmate) 金装爱+ 幼儿配方奶粉 3段(12-36个月幼儿适用) 1000克,2015-11-16,这次很不好这次很不好这次很不好这次很不好这次很不好这次很不好这次很不好这次很不好这次很不好这次很不好这次很不好这次很不好这次很不好这次很不好这次很不好这次很不好,1,差评
贝因美(Beingmate) 金装爱+ 幼儿配方奶粉 3段(12-36个月幼儿适用) 1000克,2015-11-16,真是垃圾中的垃圾，这是一次最失败的购物，里面全是疙瘩，封闭也能受潮吗？？？第一罐是宝宝奶奶喂，老人没在意，等我打开第二罐了解情况后，连续两罐都有疙瘩，（难怪我小孩最近老拉肚子，却不知原因）再也不敢给小孩吃了，难道京东只知道赚钱吗？客服也联系不上，难道客服只是摆在哪好看的吗？,1,差评
贝因美(Beingmate) 金装爱+ 幼儿配方奶粉 3段(12-36个月幼儿适用) 1000克,2015-11-15,奶粉孩子吃着还行，就是京东的价格让人琢磨不透，一样的商品一天一个价钱。有时差别很大。唉！,1,差评
贝因美(Beingmate) 金装爱+ 幼儿配方奶粉 3段(12-36个月幼儿适用) 1000克,2015-11-15,怎么扫不出积分，是假的吗,1,差评
贝因美(Beingmate) 金装爱+ 幼儿配方奶粉 3段(12-36个月幼儿适用) 1000克,2015-11-13,买的奶粉当天就降价了，还不能补差价，,1,差评
贝因美(Beingmate) 金装爱+ 幼儿配方奶粉 3段(12-36个月幼儿适用) 1000克,2015-11-10,给个勺子你们京东能亏死？  连个勺子都不给 你让老子用手抓啊,1,差评
贝因美(Beingmate) 金装爱+ 幼儿配方奶粉 3段(12-36个月幼儿适用) 1000克,2015-11-09,打开有结疙瘩，包装是密封的，实在想不通是什么原因！,1,差评
贝因美(Beingmate) 金装爱+ 幼儿配方奶粉 3段(12-36个月幼儿适用) 1000克,2015-11-08,等的好烦，，，，，，，，，，,1,差评
贝因美(Beingmate) 金装爱+ 幼儿配方奶粉 3段(12-36个月幼儿适用) 1000克,2015-11-07,货跟图片不一样，]有免逸因子，宝宝也不爱喝，跟实体店的味道差点,1,差评
贝因美(Beingmate) 金装爱+ 幼儿配方奶粉 3段(12-36个月幼儿适用) 1000克,2015-11-05,日期陈旧  又是1月份的  不是一个勺子不给就是给一把勺子。京东真是个疯孩子！,1,差评
贝因美(Beingmate) 金装爱+ 幼儿配方奶粉 3段(12-36个月幼儿适用) 1000克,2015-11-04,差评，不能兑积分也就罢啦，关键是缺斤短两，一直再在京东买奶粉，可是奶粉含量越来越少啦，图片是刚开封的，差了那么多，在实体店买的900克差不多是满的，只差一点点。这次买的2桶都是京东自营的却依旧不够量。上次买的4桶也不多。,1,差评
贝因美(Beingmate) 金装爱+ 幼儿配方奶粉 3段(12-36个月幼儿适用) 1000克,2015-11-02,差不是很好&hellip;&hellip;不是很满意,1,差评
贝因美(Beingmate) 金装爱+ 幼儿配方奶粉 3段(12-36个月幼儿适用) 1000克,2015-11-02,你敢给我一次勺吗，啊啊啊啊啊啊,1,差评
贝因美(Beingmate) 金装爱+ 幼儿配方奶粉 3段(12-36个月幼儿适用) 1000克,2015-11-02,每次都不给勺子，我也是醉了,1,差评
贝因美(Beingmate) 金装爱+ 幼儿配方奶粉 3段(12-36个月幼儿适用) 1000克,2015-11-01,"没有勺子！让我拿啥挖牛奶啊！太可恶
了！失望

",1,差评
贝因美(Beingmate) 金装爱+ 幼儿配方奶粉 3段(12-36个月幼儿适用) 1000克,2015-10-31,"狗狗狗狗狗狗狗狗狗狗狗狗狗狗狗狗狗狗狗狗
",1,差评
贝因美(Beingmate) 金装爱+ 幼儿配方奶粉 3段(12-36个月幼儿适用) 1000克,2015-10-30,一直喝这个牌子的奶粉，就是总感觉特价的日期要早一些，这筒是15年1月的，虽然没过期，但认为是京东囤的货，时间长了，才特价，第一次给差评,1,差评
贝因美(Beingmate) 金装爱+ 幼儿配方奶粉 3段(12-36个月幼儿适用) 1000克,2015-10-30,"比较垃圾&hellip;包装不错&hellip;&hellip;&hellip;&hellip;
",1,差评
贝因美(Beingmate) 金装爱+ 幼儿配方奶粉 3段(12-36个月幼儿适用) 1000克,2015-10-29,买到家不到一周就降价了***，在线联系客服说回电，到10月29日也没来电话，我今天给客服打电话说时间过了，没有价保这部是欺骗消费者吗？大家小心上当。,1,差评
贝因美(Beingmate) 金装爱+ 幼儿配方奶粉 3段(12-36个月幼儿适用) 1000克,2015-10-28,千万不要上当，，，，，这是假的，，，，，，孩子喝了都生病了，，，，，，，,1,差评
贝因美(Beingmate) 金装爱+ 幼儿配方奶粉 3段(12-36个月幼儿适用) 1000克,2015-10-27,怎么不送勺子呢？用手抓吗？,1,差评
贝因美(Beingmate) 金装爱+ 幼儿配方奶粉 3段(12-36个月幼儿适用) 1000克,2015-10-27,登录网站，积分已经充值过了，不知道是不是正品,1,差评
贝因美(Beingmate) 金装爱+ 幼儿配方奶粉 3段(12-36个月幼儿适用) 1000克,2015-10-26,差评，为什么没给勺子,1,差评
贝因美(Beingmate) 金装爱+ 幼儿配方奶粉 3段(12-36个月幼儿适用) 1000克,2015-10-25,在京东买这么久了，感觉这次买的真是一般，里面连个勺子都没有，打客服电话也没有人接听！,1,差评
贝因美(Beingmate) 金装爱+ 幼儿配方奶粉 3段(12-36个月幼儿适用) 1000克,2015-10-24,"和实体店买的味道不一样，没那个好喝，
小孩不喜欢喝。不知道什么情况",1,差评
贝因美(Beingmate) 金装爱+ 幼儿配方奶粉 3段(12-36个月幼儿适用) 1000克,2015-10-24,这个买的真心反感，还打算以后奶粉就在京东上买了呐，下单的时候是***，下完后就成***了，坑我吗，还没吃呐，以前都在物美买，第一次选择京东就这么气人，以后不打算在京东买了，差评。,1,差评
贝因美(Beingmate) 金装爱+ 幼儿配方奶粉 3段(12-36个月幼儿适用) 1000克,2015-10-23,奶粉味道比在实体店的味道淡点,1,差评
贝因美(Beingmate) 金装爱+ 幼儿配方奶粉 3段(12-36个月幼儿适用) 1000克,2015-10-23,在网上刚买了两听奶粉宝宝喝了之后老吐奶，我自己也尝了味道比在实体店买的淡多了，难道京东卖假货,1,差评
贝因美(Beingmate) 金装爱+ 幼儿配方奶粉 3段(12-36个月幼儿适用) 1000克,2015-10-23,没得发票，每次都是这样,1,差评
贝因美(Beingmate) 金装爱+ 幼儿配方奶粉 3段(12-36个月幼儿适用) 1000克,2015-10-21,不要买，千万不要买啊，我家宝宝喝了拉肚子而且奶粉很粗糙,1,差评
贝因美(Beingmate) 金装爱+ 幼儿配方奶粉 3段(12-36个月幼儿适用) 1000克,2015-10-21,重量不够，联系客服根本没人理会。推给厂家，厂家有推给京东，总之就是没人管,1,差评
贝因美(Beingmate) 金装爱+ 幼儿配方奶粉 3段(12-36个月幼儿适用) 1000克,2015-10-20,没有勺子不说了，积分码竟然已经充值过了，一下买了两听都显示已经积分过了，难道奶粉是假的？再也不相信京东了，伤心&hellip;&hellip;&hellip;&hellip;,1,差评
贝因美(Beingmate) 金装爱+ 幼儿配方奶粉 3段(12-36个月幼儿适用) 1000克,2015-10-20,买了一箱连个勺子都没有，最终还得妥协，,1,差评
贝因美(Beingmate) 金装爱+ 幼儿配方奶粉 3段(12-36个月幼儿适用) 1000克,2015-10-20,请解释一下我买的贝因美瓶罐上的积分码已经被他人使用，没有配勺子，这是什么情况？不会是假奶粉吧？,1,差评
贝因美(Beingmate) 金装爱+ 幼儿配方奶粉 3段(12-36个月幼儿适用) 1000克,2015-10-19,不好不好不好不好不好,1,差评
贝因美(Beingmate) 金装爱+ 幼儿配方奶粉 3段(12-36个月幼儿适用) 1000克,2015-10-19,奶粉跟以前不一样，感觉很假！,1,差评
