ItemName,Time,Comment,Score,Assess
贝因美(Beingmate) 冠军宝贝 幼儿配方奶粉 3段(1-3岁幼儿适用) 1000克,2018-01-28,更更更更更好红红火火哥哥哥哥哥哥,5,好评
贝因美(Beingmate) 冠军宝贝 幼儿配方奶粉 3段(1-3岁幼儿适用) 1000克,2018-01-28,我儿子吃这个奶粉还是比较好的，一直在吃。,5,好评
贝因美(Beingmate) 冠军宝贝 幼儿配方奶粉 3段(1-3岁幼儿适用) 1000克,2018-01-28,我家不挑，什么牌子的都喝。,5,好评
贝因美(Beingmate) 冠军宝贝 幼儿配方奶粉 3段(1-3岁幼儿适用) 1000克,2018-01-28,奶粉非常满意，孩子就喜欢这个牌子的，大品牌，质量好，口感好，下次还会继续买。值得信任的京东商城，谢谢,5,好评
贝因美(Beingmate) 冠军宝贝 幼儿配方奶粉 3段(1-3岁幼儿适用) 1000克,2018-01-28,忠心地感谢你，让我买到了梦寐以求的宝贝，太感谢了!,5,好评
贝因美(Beingmate) 冠军宝贝 幼儿配方奶粉 3段(1-3岁幼儿适用) 1000克,2018-01-28,包装精美，快递神速，关键是奶粉一如既往地好。贝因美奶粉是儿子的最爱。,5,好评
贝因美(Beingmate) 冠军宝贝 幼儿配方奶粉 3段(1-3岁幼儿适用) 1000克,2018-01-28,很不错的奶粉啊，超级实惠喔,5,好评
贝因美(Beingmate) 冠军宝贝 幼儿配方奶粉 3段(1-3岁幼儿适用) 1000克,2018-01-28,很不错的奶粉啊，超级实惠喔,5,好评
贝因美(Beingmate) 冠军宝贝 幼儿配方奶粉 3段(1-3岁幼儿适用) 1000克,2018-01-28,很不错的奶粉啊，超级实惠喔,5,好评
贝因美(Beingmate) 冠军宝贝 幼儿配方奶粉 3段(1-3岁幼儿适用) 1000克,2018-01-28,一直在京东买很好~~~~,5,好评
贝因美(Beingmate) 冠军宝贝 幼儿配方奶粉 3段(1-3岁幼儿适用) 1000克,2018-01-28,非常不错，一直吃的这个，谢谢,5,好评
贝因美(Beingmate) 冠军宝贝 幼儿配方奶粉 3段(1-3岁幼儿适用) 1000克,2018-01-28,价格实惠，质量比较满意。,5,好评
贝因美(Beingmate) 冠军宝贝 幼儿配方奶粉 3段(1-3岁幼儿适用) 1000克,2018-01-28,一直都好，买了存起来，备货啦！,5,好评
贝因美(Beingmate) 冠军宝贝 幼儿配方奶粉 3段(1-3岁幼儿适用) 1000克,2018-01-28,"东西买的太多了，一起评论了
京东就是快，会继续支持的，多快好省",5,好评
贝因美(Beingmate) 冠军宝贝 幼儿配方奶粉 3段(1-3岁幼儿适用) 1000克,2018-01-28,第一次买这个牌子试试看，就是不知道是不是真的，包装这些还不错的,5,好评
贝因美(Beingmate) 冠军宝贝 幼儿配方奶粉 3段(1-3岁幼儿适用) 1000克,2018-01-28,京东送货快，价格实在，而且货源充足,5,好评
贝因美(Beingmate) 冠军宝贝 幼儿配方奶粉 3段(1-3岁幼儿适用) 1000克,2018-01-28,买了几次了，给老人喝的，说还不错。,5,好评
贝因美(Beingmate) 冠军宝贝 幼儿配方奶粉 3段(1-3岁幼儿适用) 1000克,2018-01-28,品质有保证，物美价廉，婴幼儿放心产品。,5,好评
贝因美(Beingmate) 冠军宝贝 幼儿配方奶粉 3段(1-3岁幼儿适用) 1000克,2018-01-28,性价比高很有营养质量很信赖很好,5,好评
贝因美(Beingmate) 冠军宝贝 幼儿配方奶粉 3段(1-3岁幼儿适用) 1000克,2018-01-28,宝贝儿不错！值得拥有！棒棒哒！,5,好评
贝因美(Beingmate) 冠军宝贝 幼儿配方奶粉 3段(1-3岁幼儿适用) 1000克,2018-01-28,很不错，日期很新鲜孩子爱喝，信赖京东,5,好评
贝因美(Beingmate) 冠军宝贝 幼儿配方奶粉 3段(1-3岁幼儿适用) 1000克,2018-01-28,很不错，日期很新鲜孩子爱喝，信赖京东,5,好评
贝因美(Beingmate) 冠军宝贝 幼儿配方奶粉 3段(1-3岁幼儿适用) 1000克,2018-01-28,孩子喝了还多了一直信赖京东,5,好评
贝因美(Beingmate) 冠军宝贝 幼儿配方奶粉 3段(1-3岁幼儿适用) 1000克,2018-01-28,物流很快，宝宝一直喝这个牌子，这次买的还没喝喝了在去评价。,5,好评
贝因美(Beingmate) 冠军宝贝 幼儿配方奶粉 3段(1-3岁幼儿适用) 1000克,2018-01-28,好评，发货速度够快，品质佳，信价比高,5,好评
贝因美(Beingmate) 冠军宝贝 幼儿配方奶粉 3段(1-3岁幼儿适用) 1000克,2018-01-28,我刚开始还真的不相信价格这么便宜 居然这么快收到货了 太喜悦了，是我喜欢的，质量杠杠滴,5,好评
贝因美(Beingmate) 冠军宝贝 幼儿配方奶粉 3段(1-3岁幼儿适用) 1000克,2018-01-28,宝贝保护的很好，收到完好无损，质量也是没得说，杠杠的，客服态度也很好，很满意的一次购物，以后有朋友有需要就推荐这家了,5,好评
贝因美(Beingmate) 冠军宝贝 幼儿配方奶粉 3段(1-3岁幼儿适用) 1000克,2018-01-28,看上去是正品，宝贝喝是很喜欢喝的,5,好评
贝因美(Beingmate) 冠军宝贝 幼儿配方奶粉 3段(1-3岁幼儿适用) 1000克,2018-01-28,宝贝很好，大气上档次，我很喜欢，回来就用了都很好商家服务也很好，包装很好收到货没有破损的，给个大赞以后换回多关注商家的最新产品,5,好评
贝因美(Beingmate) 冠军宝贝 幼儿配方奶粉 3段(1-3岁幼儿适用) 1000克,2018-01-28,折扣真给力，信赖京东,5,好评
贝因美(Beingmate) 冠军宝贝 幼儿配方奶粉 3段(1-3岁幼儿适用) 1000克,2018-01-28,给儿子买的一直喝贝因美的，京东快递真是快，赞,5,好评
贝因美(Beingmate) 冠军宝贝 幼儿配方奶粉 3段(1-3岁幼儿适用) 1000克,2018-01-28,两个宝宝都是喝的这款奶粉，也一直是在京东购买的，支持京东自营产品。发货速度也很快，快递员也非常好，,5,好评
贝因美(Beingmate) 冠军宝贝 幼儿配方奶粉 3段(1-3岁幼儿适用) 1000克,2018-01-28,一如既往的好评，支持京东！,5,好评
贝因美(Beingmate) 冠军宝贝 幼儿配方奶粉 3段(1-3岁幼儿适用) 1000克,2018-01-28,宝宝一直都是喝贝因美的奶粉，快递也非常快。,5,好评
贝因美(Beingmate) 冠军宝贝 幼儿配方奶粉 3段(1-3岁幼儿适用) 1000克,2018-01-28,一直喝这个奶粉，满意,5,好评
贝因美(Beingmate) 冠军宝贝 幼儿配方奶粉 3段(1-3岁幼儿适用) 1000克,2018-01-28,不错 物美价廉，方便快捷是正品，京东老客户了。孩子爱喝。,5,好评
贝因美(Beingmate) 冠军宝贝 幼儿配方奶粉 3段(1-3岁幼儿适用) 1000克,2018-01-28,还好，经济实惠，价格好，日期新鲜,5,好评
贝因美(Beingmate) 冠军宝贝 幼儿配方奶粉 3段(1-3岁幼儿适用) 1000克,2018-01-28,不错的奶粉，还要再次购买,5,好评
贝因美(Beingmate) 冠军宝贝 幼儿配方奶粉 3段(1-3岁幼儿适用) 1000克,2018-01-28,"质量非常好，与卖家描述的完全一致，非常满意,真的很喜欢，完全超出期望值，发货速度非常快，包装非常仔细、严实，物流公司服务态度很好，运送速度很快，很满意的一次购物",5,好评
贝因美(Beingmate) 冠军宝贝 幼儿配方奶粉 3段(1-3岁幼儿适用) 1000克,2018-01-28,这个奶粉挺实惠  挺好的 宝宝爱喝  一直喝的这个 没有拉肚子,5,好评
贝因美(Beingmate) 冠军宝贝 幼儿配方奶粉 3段(1-3岁幼儿适用) 1000克,2018-01-28,宝宝一直喝的这个 挺好的  不过这次没有给勺子   不知为什么  不过还是给好评  快递员服务也很好   路上有雪 送货还这么的快 很赞,5,好评
贝因美(Beingmate) 冠军宝贝 幼儿配方奶粉 3段(1-3岁幼儿适用) 1000克,2018-01-28,真心喜欢在京东买东西，价格实惠，质量有保障，售后也特别的好，派送员的服务态度也很赞，东西都是正品，信赖京东！真心喜欢在京东买东西，价格实惠，质量有保障，售后也特别的好，派送员的服务态度也很赞，东西都是正品，信赖京东！,5,好评
贝因美(Beingmate) 冠军宝贝 幼儿配方奶粉 3段(1-3岁幼儿适用) 1000克,2018-01-28,经常买这家的，不错，有快，送货员也好，收到了就打开给孩子吃,5,好评
贝因美(Beingmate) 冠军宝贝 幼儿配方奶粉 3段(1-3岁幼儿适用) 1000克,2018-01-28,家里老人看孩子，感谢快递小哥还给送到楼上，谢谢了,5,好评
贝因美(Beingmate) 冠军宝贝 幼儿配方奶粉 3段(1-3岁幼儿适用) 1000克,2018-01-28,到货非常快，质量也特别好。,5,好评
贝因美(Beingmate) 冠军宝贝 幼儿配方奶粉 3段(1-3岁幼儿适用) 1000克,2018-01-28,一直京东买东西，奶粉可靠，宝宝一直都喝这个，希望多多搞活动，便宜，还有就是多给点话桑带小孩等忙完要去抢的时候已经没有了，都抢不到，真的好难抢到呀！还有就是快递很快，值得一赞。希望看到我的评价多给点豆吧，小孩睡了才有时间评价这么长，挺难的。,5,好评
贝因美(Beingmate) 冠军宝贝 幼儿配方奶粉 3段(1-3岁幼儿适用) 1000克,2018-01-28,很好，很强大，宝贝很喜欢，一直这个牌子,5,好评
贝因美(Beingmate) 冠军宝贝 幼儿配方奶粉 3段(1-3岁幼儿适用) 1000克,2018-01-28,我家宝贝一直在吃，快过年了囤货 ，刚好有优惠  很好,5,好评
贝因美(Beingmate) 冠军宝贝 幼儿配方奶粉 3段(1-3岁幼儿适用) 1000克,2018-01-28,还可以吧，我家宝贝一直喝的这个奶粉,3,中评
贝因美(Beingmate) 冠军宝贝 幼儿配方奶粉 3段(1-3岁幼儿适用) 1000克,2018-01-28,快递真没得说，一如既往快,5,好评
贝因美(Beingmate) 冠军宝贝 幼儿配方奶粉 3段(1-3岁幼儿适用) 1000克,2018-01-28,我家宝贝一直喝这个，很实惠，也方便。,5,好评
贝因美(Beingmate) 冠军宝贝 幼儿配方奶粉 3段(1-3岁幼儿适用) 1000克,2018-01-28,快递送货速度快，奶粉质量可以小孩子一直吃！！,5,好评
贝因美(Beingmate) 冠军宝贝 幼儿配方奶粉 3段(1-3岁幼儿适用) 1000克,2018-01-28,小孩三岁了，一直喝这，值得信赖,5,好评
贝因美(Beingmate) 冠军宝贝 幼儿配方奶粉 3段(1-3岁幼儿适用) 1000克,2018-01-28,满意，京东快递服务态度很好,5,好评
贝因美(Beingmate) 冠军宝贝 幼儿配方奶粉 3段(1-3岁幼儿适用) 1000克,2018-01-28,我家小孩一直喝这个牌子的奶粉，感觉还不错，就是送货速度太慢！,5,好评
贝因美(Beingmate) 冠军宝贝 幼儿配方奶粉 3段(1-3岁幼儿适用) 1000克,2018-01-27,东西不错满分666666666很好看很好用没毛病老铁哈哈哈哈啊哈哈啊啊哈宝宝很喜欢,5,好评
贝因美(Beingmate) 冠军宝贝 幼儿配方奶粉 3段(1-3岁幼儿适用) 1000克,2018-01-27,哈出了新高度、在于他在我身边吧、这种人就是我不敢做敢问这问的是不是很,5,好评
贝因美(Beingmate) 冠军宝贝 幼儿配方奶粉 3段(1-3岁幼儿适用) 1000克,2018-01-27,京东购物从未让人失望物流速度超快！,5,好评
贝因美(Beingmate) 冠军宝贝 幼儿配方奶粉 3段(1-3岁幼儿适用) 1000克,2018-01-27,质量不错  很好   物流给力辛苦快递员了,5,好评
贝因美(Beingmate) 冠军宝贝 幼儿配方奶粉 3段(1-3岁幼儿适用) 1000克,2018-01-27,商品非常不错，质量好，物流很快，你值得拥有,5,好评
贝因美(Beingmate) 冠军宝贝 幼儿配方奶粉 3段(1-3岁幼儿适用) 1000克,2018-01-27,不错，一直都在吃的，适合宝宝的,5,好评
贝因美(Beingmate) 冠军宝贝 幼儿配方奶粉 3段(1-3岁幼儿适用) 1000克,2018-01-27,好奶粉，便宜又实惠，孩子喜欢。,5,好评
贝因美(Beingmate) 冠军宝贝 幼儿配方奶粉 3段(1-3岁幼儿适用) 1000克,2018-01-27,孩子喜欢喝，不错的奶粉,5,好评
贝因美(Beingmate) 冠军宝贝 幼儿配方奶粉 3段(1-3岁幼儿适用) 1000克,2018-01-27,好，奔着试试的态度买的，宝宝喝着很好！！信赖京东！！,5,好评
贝因美(Beingmate) 冠军宝贝 幼儿配方奶粉 3段(1-3岁幼儿适用) 1000克,2018-01-27,新人第一单，厉害了！,5,好评
贝因美(Beingmate) 冠军宝贝 幼儿配方奶粉 3段(1-3岁幼儿适用) 1000克,2018-01-27,一直在京东购买奶粉，相信自营的,5,好评
贝因美(Beingmate) 冠军宝贝 幼儿配方奶粉 3段(1-3岁幼儿适用) 1000克,2018-01-27,物流超快，比实体店便宜，很满意,5,好评
贝因美(Beingmate) 冠军宝贝 幼儿配方奶粉 3段(1-3岁幼儿适用) 1000克,2018-01-27,第二次购买啦，还不错。,5,好评
贝因美(Beingmate) 冠军宝贝 幼儿配方奶粉 3段(1-3岁幼儿适用) 1000克,2018-01-27,很好，正品，，下次还来买,5,好评
贝因美(Beingmate) 冠军宝贝 幼儿配方奶粉 3段(1-3岁幼儿适用) 1000克,2018-01-27,大品牌，值得信赖，心不错,5,好评
贝因美(Beingmate) 冠军宝贝 幼儿配方奶粉 3段(1-3岁幼儿适用) 1000克,2018-01-27,为了抢这个优惠券，等了好长的时间，终于下单成功了，和朋友们一起买的这个产品非常的好，期待以后多，出特价。,5,好评
贝因美(Beingmate) 冠军宝贝 幼儿配方奶粉 3段(1-3岁幼儿适用) 1000克,2018-01-27,还没打开呢，先囤货，一直吃的贝因美，应该差不了,5,好评
贝因美(Beingmate) 冠军宝贝 幼儿配方奶粉 3段(1-3岁幼儿适用) 1000克,2018-01-27,宝宝非常爱喝，宝宝一直喝这个牌子不上火?,5,好评
贝因美(Beingmate) 冠军宝贝 幼儿配方奶粉 3段(1-3岁幼儿适用) 1000克,2018-01-27,非常不错，便宜实惠，下次再买,5,好评
贝因美(Beingmate) 冠军宝贝 幼儿配方奶粉 3段(1-3岁幼儿适用) 1000克,2018-01-27,孩子很喜欢喝，是正品！包装也很好！,5,好评
贝因美(Beingmate) 冠军宝贝 幼儿配方奶粉 3段(1-3岁幼儿适用) 1000克,2018-01-27,很不错的商品，质量不错，是正品的，京东品质，没得说，继续买买买,5,好评
贝因美(Beingmate) 冠军宝贝 幼儿配方奶粉 3段(1-3岁幼儿适用) 1000克,2018-01-27,推荐这家店，京东买的东西就是好,5,好评
贝因美(Beingmate) 冠军宝贝 幼儿配方奶粉 3段(1-3岁幼儿适用) 1000克,2018-01-27,奶粉一直都是买的京东自营，京东快递也一直比较快，虽然这次稍慢，但可以理解，因为下大雪。,5,好评
贝因美(Beingmate) 冠军宝贝 幼儿配方奶粉 3段(1-3岁幼儿适用) 1000克,2018-01-27,小宝改断奶了，大宝也是喝的贝因美，小宝也爱喝,5,好评
贝因美(Beingmate) 冠军宝贝 幼儿配方奶粉 3段(1-3岁幼儿适用) 1000克,2018-01-27,发货的速度很快，第二天就到了，日期也很新鲜，奶粉也很细腻，小孩子喜欢喝,5,好评
贝因美(Beingmate) 冠军宝贝 幼儿配方奶粉 3段(1-3岁幼儿适用) 1000克,2018-01-27,一直在喝这个牌子的奶粉，非常好，宝宝爱喝！,5,好评
贝因美(Beingmate) 冠军宝贝 幼儿配方奶粉 3段(1-3岁幼儿适用) 1000克,2018-01-27,第三次购买，依然很好，特别送货很快?,5,好评
贝因美(Beingmate) 冠军宝贝 幼儿配方奶粉 3段(1-3岁幼儿适用) 1000克,2018-01-27,宝宝3岁了一直喝这个牌子奶粉，没有喝过别的，还是不错的，挺好,5,好评
贝因美(Beingmate) 冠军宝贝 幼儿配方奶粉 3段(1-3岁幼儿适用) 1000克,2018-01-27,非常感谢京东商城给予的优质的服务，从仓储管理、物流配送等各方面都是做的非常好的。送货及时，配送员也非常的热情，有时候不方便收件的时候，也安排时间另行配送。同时京东商城在售后管理上也非常好的，以解客户忧患，排除万难。给予我们非常好的购物体验。,5,好评
贝因美(Beingmate) 冠军宝贝 幼儿配方奶粉 3段(1-3岁幼儿适用) 1000克,2018-01-27,包装精美，价格实惠，送货速度很快，我还会回来的买的。,5,好评
贝因美(Beingmate) 冠军宝贝 幼儿配方奶粉 3段(1-3岁幼儿适用) 1000克,2018-01-27,双12一次性买了好几罐，宝贝一直喝这个牌子的奶粉！感觉挺好的,5,好评
贝因美(Beingmate) 冠军宝贝 幼儿配方奶粉 3段(1-3岁幼儿适用) 1000克,2018-01-27,价格很给力，快递也神速！,5,好评
贝因美(Beingmate) 冠军宝贝 幼儿配方奶粉 3段(1-3岁幼儿适用) 1000克,2018-01-27,看起来还不错的，给孩子喝的，过段时间再说吧。,5,好评
贝因美(Beingmate) 冠军宝贝 幼儿配方奶粉 3段(1-3岁幼儿适用) 1000克,2018-01-27,好评  质量挺好的  是正品 还会再买,5,好评
贝因美(Beingmate) 冠军宝贝 幼儿配方奶粉 3段(1-3岁幼儿适用) 1000克,2018-01-27,非常感谢京东商城给予的优质的服务，从仓储管理、物流配送等各方面都是做的非常好的。送货反时，配送员也非常的热情，有时候不方便收件的时候，也安排时间另行配送。同时京东商城在售后管理上也非常好的，以解客户忧患，排除万难。给予我们非常好的购物体验,5,好评
贝因美(Beingmate) 冠军宝贝 幼儿配方奶粉 3段(1-3岁幼儿适用) 1000克,2018-01-27,东西不错价格便宜货真价实在京东买东西，放心,5,好评
贝因美(Beingmate) 冠军宝贝 幼儿配方奶粉 3段(1-3岁幼儿适用) 1000克,2018-01-27,东西不错价格便宜，物超所值，在京东买东西就对了,5,好评
贝因美(Beingmate) 冠军宝贝 幼儿配方奶粉 3段(1-3岁幼儿适用) 1000克,2018-01-27,宝宝喝这牌子奶粉很久了，个人感觉不错,5,好评
贝因美(Beingmate) 冠军宝贝 幼儿配方奶粉 3段(1-3岁幼儿适用) 1000克,2018-01-27,非常感谢京东商城给予的优质的服务，从仓储管理、物流配送等各方面都是做的非常好的。送货及时，配送员也非常的热情，有时候不方便收件的时候，也安排时间另行配送。同时京东商城在售后管理上也非常好的，以解客户忧患，排除万难。给予我们非常好的购物体验。,5,好评
贝因美(Beingmate) 冠军宝贝 幼儿配方奶粉 3段(1-3岁幼儿适用) 1000克,2018-01-27,东西不错，包的也挺好，是正品没毛病,5,好评
贝因美(Beingmate) 冠军宝贝 幼儿配方奶粉 3段(1-3岁幼儿适用) 1000克,2018-01-27,老人喜欢喝这个奶粉，很便宜很实惠,5,好评
贝因美(Beingmate) 冠军宝贝 幼儿配方奶粉 3段(1-3岁幼儿适用) 1000克,2018-01-26,宝宝一直再喝，感觉还行～京东物流神速！,5,好评
贝因美(Beingmate) 冠军宝贝 幼儿配方奶粉 3段(1-3岁幼儿适用) 1000克,2018-01-26,掌柜的服务态度真好，发货很快。商品质量也相当不错。太喜欢了，谢谢！,5,好评
贝因美(Beingmate) 冠军宝贝 幼儿配方奶粉 3段(1-3岁幼儿适用) 1000克,2018-01-26,非常感谢京东商城给予的优质的服务，从仓储管理、物流配送等各方面都是做的非常好的。送货及时，配送员也非常的热情，有时候不方便收件也安排时间另行配送。同时京东商城在售后管理上也非常好的，以解客户忧患，排除万难。给予我们非常好的购物体验。,5,好评
贝因美(Beingmate) 冠军宝贝 幼儿配方奶粉 3段(1-3岁幼儿适用) 1000克,2018-01-26,一直京东买的奶粉，可靠,5,好评
贝因美(Beingmate) 冠军宝贝 幼儿配方奶粉 3段(1-3岁幼儿适用) 1000克,2018-01-26,宝宝很爱喝！味道还不错！,5,好评
贝因美(Beingmate) 冠军宝贝 幼儿配方奶粉 3段(1-3岁幼儿适用) 1000克,2018-01-26,一如既往，孩子都习惯了,5,好评
贝因美(Beingmate) 冠军宝贝 幼儿配方奶粉 3段(1-3岁幼儿适用) 1000克,2018-01-26,一直都是在这里买 但是这次真的不满意，看图吧第一次用这种箱子送来的而且开箱后看到每一罐的验证码都翘起来了像是刚贴上去的，这次的有点不放心是不是真的,1,差评
贝因美(Beingmate) 冠军宝贝 幼儿配方奶粉 3段(1-3岁幼儿适用) 1000克,2018-01-26,宝宝从出生就一直在喝贝因美的奶粉，家里俩宝，所以选的性价比高的，孩子也一直很爱喝，信赖京东,5,好评
贝因美(Beingmate) 冠军宝贝 幼儿配方奶粉 3段(1-3岁幼儿适用) 1000克,2018-01-26,双十一后一直给宝宝吃的冠军宝贝，挺不错的，今天看到降价了，继续下单备了两听年货！,5,好评
贝因美(Beingmate) 冠军宝贝 幼儿配方奶粉 3段(1-3岁幼儿适用) 1000克,2018-01-26,一直买这个牌子的，感觉还行，也想换个好点的，不知道会不会适应，所以没换。,5,好评
贝因美(Beingmate) 冠军宝贝 幼儿配方奶粉 3段(1-3岁幼儿适用) 1000克,2018-01-26,帮邻居买的，说的很不错，以后还会再,5,好评
贝因美(Beingmate) 冠军宝贝 幼儿配方奶粉 3段(1-3岁幼儿适用) 1000克,2018-01-26,还没吃完就再来一箱，大宝小宝都是吃这个牌子长大的,5,好评
贝因美(Beingmate) 冠军宝贝 幼儿配方奶粉 3段(1-3岁幼儿适用) 1000克,2018-01-26,奶粉挺好，就价格涨价了好多，,5,好评
贝因美(Beingmate) 冠军宝贝 幼儿配方奶粉 3段(1-3岁幼儿适用) 1000克,2018-01-26,很愉快的一次购物体验，物超所值，下次还来买。,5,好评
贝因美(Beingmate) 冠军宝贝 幼儿配方奶粉 3段(1-3岁幼儿适用) 1000克,2018-01-26,很好用，一直在京东买东西，快递也快！,5,好评
贝因美(Beingmate) 冠军宝贝 幼儿配方奶粉 3段(1-3岁幼儿适用) 1000克,2018-01-26,宝贝儿不错！值得拥有！棒棒哒,5,好评
贝因美(Beingmate) 冠军宝贝 幼儿配方奶粉 3段(1-3岁幼儿适用) 1000克,2018-01-26,给孩子买来过年屯着的，孩子一直喝贝因美的，不上火,5,好评
贝因美(Beingmate) 冠军宝贝 幼儿配方奶粉 3段(1-3岁幼儿适用) 1000克,2018-01-26,喝了第二罐了  挺好的,5,好评
贝因美(Beingmate) 冠军宝贝 幼儿配方奶粉 3段(1-3岁幼儿适用) 1000克,2018-01-26,喝的第二罐了  挺好的,5,好评
贝因美(Beingmate) 冠军宝贝 幼儿配方奶粉 3段(1-3岁幼儿适用) 1000克,2018-01-26,感谢京东物流！好奶粉，大品牌值得信赖！,5,好评
贝因美(Beingmate) 冠军宝贝 幼儿配方奶粉 3段(1-3岁幼儿适用) 1000克,2018-01-26,孩子一直吃这个奶粉，赞,5,好评
贝因美(Beingmate) 冠军宝贝 幼儿配方奶粉 3段(1-3岁幼儿适用) 1000克,2018-01-26,已经买了很多桶了，宝贝很喜欢，非常实惠！一直都是吃的这个牌子的奶粉，值得信赖！赞一个！,5,好评
贝因美(Beingmate) 冠军宝贝 幼儿配方奶粉 3段(1-3岁幼儿适用) 1000克,2018-01-26,已经买了很多桶了，宝贝一直吃的这个牌子的奶粉，真心不错，还实惠！,5,好评
贝因美(Beingmate) 冠军宝贝 幼儿配方奶粉 3段(1-3岁幼儿适用) 1000克,2018-01-26,孩子爱喝，妈妈喜欢，信任京东，都是在京东上面买的,5,好评
贝因美(Beingmate) 冠军宝贝 幼儿配方奶粉 3段(1-3岁幼儿适用) 1000克,2018-01-26,奶粉很好，物流很快，包装很好，活动价买的很划算会再来希望以后多搞活动。,5,好评
贝因美(Beingmate) 冠军宝贝 幼儿配方奶粉 3段(1-3岁幼儿适用) 1000克,2018-01-26,戒奶以后一直喝，不错,5,好评
贝因美(Beingmate) 冠军宝贝 幼儿配方奶粉 3段(1-3岁幼儿适用) 1000克,2018-01-26,商品很不错     送货很快,5,好评
贝因美(Beingmate) 冠军宝贝 幼儿配方奶粉 3段(1-3岁幼儿适用) 1000克,2018-01-26,孩子一直喝这个牌子的，也没有喝过别的，挺信任这个牌孑的，希望不让我失望。,5,好评
贝因美(Beingmate) 冠军宝贝 幼儿配方奶粉 3段(1-3岁幼儿适用) 1000克,2018-01-26,京东物美价廉，平台系统购物体验愉悦，购买到的宝贝质量很好，物流光速，客服处理问题也十分专业，继续支持。,5,好评
贝因美(Beingmate) 冠军宝贝 幼儿配方奶粉 3段(1-3岁幼儿适用) 1000克,2018-01-26,一直吃的一个奶粉，还是可以的,5,好评
贝因美(Beingmate) 冠军宝贝 幼儿配方奶粉 3段(1-3岁幼儿适用) 1000克,2018-01-26,还可以吧，一直在京东买的,5,好评
贝因美(Beingmate) 冠军宝贝 幼儿配方奶粉 3段(1-3岁幼儿适用) 1000克,2018-01-26,不错不错 宝宝直接换的这款。没有不适。正品。,5,好评
贝因美(Beingmate) 冠军宝贝 幼儿配方奶粉 3段(1-3岁幼儿适用) 1000克,2018-01-26,一直在京东买，比较放心,5,好评
贝因美(Beingmate) 冠军宝贝 幼儿配方奶粉 3段(1-3岁幼儿适用) 1000克,2018-01-26,一直吃的这个，还不错,5,好评
贝因美(Beingmate) 冠军宝贝 幼儿配方奶粉 3段(1-3岁幼儿适用) 1000克,2018-01-26,信赖京东，包装很好，完全没破损，还没吃，囤货中,5,好评
贝因美(Beingmate) 冠军宝贝 幼儿配方奶粉 3段(1-3岁幼儿适用) 1000克,2018-01-26,"货超值，呵，下次再来。帮你做个广告，朋友们：这家店的货值。
一个字！！值！！！
掌柜的服务态度真好，发货很快。商品质量也相当不错。太喜欢了，谢谢！
好卖家，真有耐心，我终于买到想要的东西了。",5,好评
贝因美(Beingmate) 冠军宝贝 幼儿配方奶粉 3段(1-3岁幼儿适用) 1000克,2018-01-26,宝宝喝着不错，相信京东自营！,5,好评
贝因美(Beingmate) 冠军宝贝 幼儿配方奶粉 3段(1-3岁幼儿适用) 1000克,2018-01-26,已经买好几次了，宝宝喝着还不错，没有不良反应！,5,好评
贝因美(Beingmate) 冠军宝贝 幼儿配方奶粉 3段(1-3岁幼儿适用) 1000克,2018-01-26,很不错的商品哦！！！！！！！相信京东商城，物流很快，快递员态度很好！,5,好评
